{
  "ecnId": "ECN-20260521-0001",
  "ecrId": "ECR-20260520-0001",
  "createdAt": "2026-05-21T08:00:00Z",
  "title": "Implement A-12 cable re-route (T7-T8-T9) across design, planning, and supplier",
  "effectivity": "2026-06-15",
  "affectedItems": [
    { "itemId": "PNL-A12-Rev-D", "itemType": "assembly", "supplierId": "sup-acme-001", "quantity": 1 },
    { "itemId": "WHN-A12-cable-7", "itemType": "part", "supplierId": "sup-acme-001", "quantity": 1 }
  ],
  "implementationPlan": [
    { "task": "update design", "owner": "design-engineer", "status": "done" },
    { "task": "update planning", "owner": "manufacturing-engineer", "status": "in-progress" },
    { "task": "update packaging & labels", "owner": "packaging", "status": "pending" },
    { "task": "update publications", "owner": "publications", "status": "pending" }
  ],
  "supplierActions": [
    { "supplierId": "sup-acme-001", "channel": "api", "status": "accepted", "updatedAt": "2026-05-21T11:20:00Z" }
  ],
  "cibApproval": {
    "approved": true,
    "approvedBy": "cib-chair",
    "approvedAt": "2026-05-21T09:30:00Z",
    "aiAssisted": true
  },
  "qualityControl": {
    "verified": false,
    "notes": "Pending physical verification after supplier implementation."
  },
  "releaseStatus": "in-implementation",
  "auditTrail": [
    { "at": "2026-05-21T08:00:00Z", "by": "change-specialist", "event": "ecn-created" },
    { "at": "2026-05-21T09:30:00Z", "by": "cib-chair", "event": "cib-approved" },
    { "at": "2026-05-21T11:20:00Z", "by": "supplier-adapter", "event": "supplier-notified" }
  ]
}
